{
  "schema_version": "helix-harness-alignment.v1",
  "authority": "canonical",
  "source": {
    "repository": "RetryYN/HELIX-HARNESS",
    "url": "https://github.com/RetryYN/HELIX-HARNESS/",
    "commit": "57853db413e282b050ac5f37bab7809321c67842",
    "read_only": true
  },
  "adoption": {
    "mode": "methodology-and-development-environment",
    "runtime": "python-native",
    "bun_active_dependency": false,
    "product_runtime_dependency": "none",
    "current_layer_model": "L0-L6",
    "template_layer_model": "L0-L14",
    "requirements_scope": "requirements-definition-through-L3-and-L2-prototype"
  },
  "mappings": [
    {
      "id": "v-model",
      "template_paths": ["README.md", "docs/design/harness/"],
      "current_paths": ["README.md", "CLAUDE.md", "docs/00-authority/requirements-gates.md"],
      "status": "adapted",
      "rationale": "L0-L14 の考え方を現行 L0-L6 と機械ゲートの工程語彙へ写像する。"
    },
    {
      "id": "requirement-ir",
      "template_paths": ["requirements-ir/manifest.json", "requirements-ir/*.json", "config/requirement-ir-schema.json"],
      "current_paths": ["docs/L1-business-requirements/canonical/br/br-contracts.json", "docs/L3-system-requirements/canonical/functional/fr-contracts.json", "docs/L3-system-requirements/canonical/acceptance/ac-contracts.json", "docs/L3-system-requirements/verification/tc-contracts.json", "docs/L6-feature-design/S0/implementation-units.json"],
      "status": "bridge",
      "rationale": "stable ID と要求連鎖だけを採用し、現行の契約 JSON 9 本を唯一の実装入力として二重正本を作らない。"
    },
    {
      "id": "discovery-lifecycle",
      "template_paths": ["config/requirement-discovery-event-schema.json", "docs/design/harness/"],
      "current_paths": ["docs/00-authority/development/requirement-definition-workflow_v0.1.md", "docs/00-authority/audits/"],
      "status": "deferred",
      "rationale": "候補・質問・試作・観測・仕様化・検証・承認の順序を文書化した。append-only discovery event ledger は別導入まで保留する。"
    },
    {
      "id": "l2-screen-template",
      "template_paths": ["docs/design/harness/L2-screen/screen-list.md", "docs/design/harness/L2-screen/screen-flow.md", "docs/design/harness/L2-screen/ui-element.md", "docs/design/harness/L2-screen/wireframe.md", "docs/design/harness/L2-screen/screen-detail.md"],
      "current_paths": ["docs/L2-prototypes/README.md", "docs/L2-prototypes/screens/ui-screen-list_v0.1.md", "docs/L2-prototypes/screens/screen-flow_v0.1.md", "docs/L2-prototypes/screens/ui-element_v0.1.md", "docs/L2-prototypes/screens/wireframe_v0.1.md", "docs/L2-prototypes/screens/screen-detail_v0.1.md", "docs/L2-prototypes/workflows/business-flow_v0.1.md"],
      "status": "adopted",
      "rationale": "5 点セットを S1 draft として揃え、画面入口・状態・失敗・write 境界・アクセシビリティを追跡可能にする。"
    },
    {
      "id": "developer-loop",
      "template_paths": ["package.json", "scripts/", ".github/"],
      "current_paths": ["Makefile", "scripts/dev.py", "scripts/collect_test_outcome.py", "pyproject.toml", "uv.lock", "tools/gates/run_all.py"],
      "status": "adapted",
      "rationale": "setup／doctor／docs／gates／test を uv、生成ビュー、既存全ゲート、pytest の Python 導線で提供する。"
    },
    {
      "id": "hooks-and-authority",
      "template_paths": [".codex/hooks.json", ".helix/", ".github/"],
      "current_paths": ["AGENTS.md", "CLAUDE.md", ".claude/agents/codex-luna.md", ".claude/agents/codex-sol.md", ".claude/agents/codex-terra.md", "scripts/hooks/pre-git-gate.sh", "docs/00-authority/artifact-manifest.json", "docs/00-authority/baselines/baseline.json"],
      "status": "adapted",
      "rationale": "外部テンプレートの hook 実装は持ち込まず、現行の manifest／baseline／pre-git hook を権威境界として維持する。"
    }
  ],
  "gaps": [
    {
      "id": "runtime-l7-l14",
      "status": "deferred",
      "reason": "本リポジトリは要件定義と L2/L3 の段階で、テンプレートの下流ランタイムを実装入力にしない。"
    },
    {
      "id": "bun-node-runtime",
      "status": "not-applicable",
      "reason": "Python 単一パッケージ規律と既存ゲートを優先し、Bun／Node を active dependency にしない。"
    }
  ],
  "required_checks": [
    "python3 scripts/render_views.py --check",
    "python3 tools/gates/run_all.py",
    "make doctor",
    "make lint",
    "make typecheck",
    "make imports",
    "make build",
    "make test",
    "make check"
  ]
}
